{
  "report_id": "RPT-2026-000008",
  "short_code": "DVVX-GNDU",
  "synthetic": true,
  "issued_at": "2026-10-17T10:15:00+06:00",
  "valid_until": "2026-10-24T10:15:00+06:00",
  "plot": {
    "plot_id": "P-008",
    "district_id": "cumilla",
    "upazila_id": "burichang",
    "mouza_id": "m-cml-bur-02",
    "jl_no": "68",
    "survey": "BS",
    "khatian_no": "954",
    "dag_no": "3366",
    "area_decimal": 33.0,
    "land_class": "ধান"
  },
  "seller": {
    "name": "মোঃ আব্দুল করিম",
    "father_or_husband": null,
    "match": {
      "tier": "PROBABLE",
      "score": 0.88
    }
  },
  "consents": {
    "bank": true
  },
  "verdict": "AMBER",
  "coverage": {
    "Q1": "COVERED",
    "Q2": "COVERED",
    "Q3": "COVERED",
    "Q4": "COVERED",
    "Q5": "COVERED",
    "Q6": "COVERED"
  },
  "findings": [
    {
      "rule_id": "R-OWN-02",
      "severity": "MEDIUM",
      "confidence": "MEDIUM",
      "question": "Q1",
      "evidence": [],
      "params": {
        "tier": "PROBABLE"
      }
    },
    {
      "rule_id": "R-INFO-02",
      "severity": "INFO",
      "confidence": "HIGH",
      "question": "Q2",
      "evidence": [],
      "params": {
        "depth": 3
      }
    },
    {
      "rule_id": "R-INFO-03",
      "severity": "INFO",
      "confidence": "HIGH",
      "question": "Q2",
      "evidence": [],
      "params": {
        "last_transfer_date": "2010-05-18"
      }
    }
  ],
  "sources": [
    {
      "source": "land_records",
      "status": "OK",
      "as_of": "2026-10-16T10:15:00+06:00",
      "maturity": "M3",
      "linkage": null,
      "latency_ms": 120,
      "record_count": 3,
      "reason": null
    },
    {
      "source": "registry",
      "status": "OK",
      "as_of": "2026-10-16T10:15:00+06:00",
      "maturity": "M2",
      "linkage": null,
      "latency_ms": 200,
      "record_count": 1,
      "reason": null
    },
    {
      "source": "mutation",
      "status": "OK",
      "as_of": "2026-10-16T10:15:00+06:00",
      "maturity": "M3",
      "linkage": null,
      "latency_ms": 150,
      "record_count": 1,
      "reason": null
    },
    {
      "source": "court",
      "status": "NO_RECORD",
      "as_of": "2026-10-16T10:15:00+06:00",
      "maturity": "M2",
      "linkage": "TEXT_MATCH",
      "latency_ms": 250,
      "record_count": 0,
      "reason": null
    },
    {
      "source": "khas",
      "status": "OK",
      "as_of": "2026-10-16T10:15:00+06:00",
      "maturity": "M2",
      "linkage": null,
      "latency_ms": 180,
      "record_count": 0,
      "reason": null
    },
    {
      "source": "bank",
      "status": "OK",
      "as_of": "2026-10-16T10:15:00+06:00",
      "maturity": "M3",
      "linkage": null,
      "latency_ms": 220,
      "record_count": 0,
      "reason": null
    }
  ],
  "holders_summary": {
    "holder_count": 1,
    "seller_share": "1"
  },
  "timeline": [
    {
      "date": "1926-03-14",
      "kind": "SURVEY_ENTRY",
      "survey": "CS",
      "from_masked": null,
      "to_masked": "শা**** মো**",
      "share": null,
      "area_decimal": 33.0,
      "record_ref": "LND-0022",
      "source": "land_records",
      "flagged_by": []
    },
    {
      "date": "1985-07-02",
      "kind": "INHERITANCE",
      "survey": null,
      "from_masked": "শা**** মো**",
      "to_masked": "ব** খা*",
      "share": null,
      "area_decimal": null,
      "record_ref": "MUT-0009",
      "source": "mutation",
      "flagged_by": []
    },
    {
      "date": "1993-11-20",
      "kind": "SURVEY_ENTRY",
      "survey": "RS",
      "from_masked": null,
      "to_masked": "ব** খা*",
      "share": null,
      "area_decimal": 33.0,
      "record_ref": "LND-0023",
      "source": "land_records",
      "flagged_by": []
    },
    {
      "date": "2010-05-18",
      "kind": "SALE",
      "survey": null,
      "from_masked": "ব** খা*",
      "to_masked": "মো**** আ*** ক**",
      "share": "1",
      "area_decimal": 33.0,
      "record_ref": "REG-0012",
      "source": "registry",
      "flagged_by": []
    },
    {
      "date": "2018-02-09",
      "kind": "SURVEY_ENTRY",
      "survey": "BS",
      "from_masked": null,
      "to_masked": "মো**** আ*** ক**",
      "share": null,
      "area_decimal": 33.0,
      "record_ref": "LND-0024",
      "source": "land_records",
      "flagged_by": []
    }
  ],
  "not_checked": [
    {
      "code": "static_physical_possession",
      "params": {}
    },
    {
      "code": "static_boundaries",
      "params": {}
    },
    {
      "code": "static_unregistered_agreements",
      "params": {}
    },
    {
      "code": "static_equitable_mortgage",
      "params": {}
    },
    {
      "code": "static_seller_documents",
      "params": {}
    },
    {
      "code": "static_legal_review",
      "params": {}
    }
  ],
  "ledger": {
    "ok": true,
    "broken_at_seq": null,
    "reason": null,
    "height": 5,
    "head_hash": "sha256:d21b6ab251a2f38c8f7061d54dc517516ff1b6bca09b383de0b0cdb9483cbdbe",
    "checkpoint": {
      "height": 5,
      "head_hash": "sha256:d21b6ab251a2f38c8f7061d54dc517516ff1b6bca09b383de0b0cdb9483cbdbe",
      "ts": "2026-10-17T10:15:00+06:00",
      "key_id": "demo-2026-01",
      "signature_b64": "ZTyJ2qVcgcYBn8bnCKOgwjUA60kOUV6lpVbCyjkx9d1pVONGOtlh7fCDhaIX1QU2fLToOwUFOEgVvWvae7xADQ"
    }
  },
  "key_id": "demo-2026-01",
  "signed_payload_b64": "eyJmaW5kaW5nc19oYXNoIjoic2hhMjU2OjA2OWJhYjAzOGNlZTcwNDRlZGExNTliYTUxNzE5NDQ2MDRlOTAxYjYxOTFkMTcxZWFmYjNhYjI2ODY4MjUwMjMiLCJpc3N1ZWRfYXQiOiIyMDI2LTEwLTE3VDEwOjE1OjAwKzA2OjAwIiwia2V5X2lkIjoiZGVtby0yMDI2LTAxIiwibGVkZ2VyX2hlYWQiOiJzaGEyNTY6ZDIxYjZhYjI1MWEyZjM4YzhmNzA2MWQ1NGRjNTE3NTE2ZmYxYjZiY2EwOWIzODNkZTBiMGNkYjk0ODNjYmRiZSIsImxlZGdlcl9oZWlnaHQiOjUsInBsb3RfaWQiOiJQLTAwOCIsInJlcG9ydF9pZCI6IlJQVC0yMDI2LTAwMDAwOCIsInNob3J0X2NvZGUiOiJEVlZYLUdORFUiLCJ2IjoxLCJ2YWxpZF91bnRpbCI6IjIwMjYtMTAtMjRUMTA6MTU6MDArMDY6MDAiLCJ2ZXJkaWN0IjoiQU1CRVIifQ",
  "signature_b64": "vUS73C1azNhtcu_ihsRQHZIx_j6FrpDNUzM95FwZaSe1uloYmISW2v5ztRWzwbkb06-cQsJ2QGSK7CwVGDT9BA"
}
